<?xml version="1.0" encoding="UTF-8"?>
<!DOCTYPE employee PUBLIC "employee" "Test.dtd" >
<employee>
	<name>Pradeep</name>
	<age>21</age>
	<address>
		<house-no>22</house-no>
		<lane>8</lane>
		<city>Bangalore</city>
		<state>Karnataka</state>
		<zip>544554</zip>
	</address>
	<address>
		<house-no>22</house-no>
		<street>7th Main</street>
		<lane>8</lane>
		<city>Bangalore</city>
		<state>Karnataka</state>
		<zip>544554</zip>
	</address>
	<from>Hydrabad</from>
	<dob>
		<month>05</month>
		<date>21</date>
		<year>1983</year>
	</dob>
	<profession>Developer</profession>
</employee>

